<Payload xmlns="http://javaops.ru"
         xmlns:xsi="http://www.w3.org/2001/XMLSchema-instance"
         xsi:schemaLocation="http://javaops.ru payload.xsd">
    <Project name="topjava">
        <description>Описание проекта Top Java.</description>
        <Group name="topjava01" type="FINISHED">
            <User fullName="Admin" email="admin@javaops.ru" city="spb" flag="SUPERUSER"/>
            <User fullName="User1 topjava01" email="user1t01@usermail.ru" city="kiv" flag="ACTIVE"/>
            <User fullName="User2 topjava01" email="user2t01@usermail.ru" city="mnsk" flag="DELETED"/>
        </Group>
        <Group name="topjava02" type="CURRENT">
            <User fullName="Admin" email="admin@javaops.ru" city="spb" flag="SUPERUSER"/>
            <User fullName="User1 topjava02" email="user1t02@usermail.ru" city="kiv" flag="ACTIVE"/>
            <User fullName="User2 topjava02" email="user2t02@usermail.ru" city="mnsk" flag="DELETED"/>
        </Group>
        <Group name="topjava03" type="REGISTERING">
            <User fullName="Admin" email="admin@javaops.ru" city="spb" flag="SUPERUSER"/>
            <User fullName="User1 topjava03" email="user1t03@usermail.ru" city="kiv" flag="ACTIVE"/>
            <User fullName="User2 topjava03" email="user2t03@usermail.ru" city="mnsk" flag="DELETED"/>
        </Group>
    </Project>
    <Project name="masterjava">
        <description>Описание проекта Master Java.</description>
        <Group name="masterjava01" type="FINISHED">
            <User fullName="Admin" email="admin@javaops.ru" city="spb" flag="SUPERUSER"/>
            <User fullName="User1 masterjava01" email="user1m01@usermail.ru" city="kiv" flag="ACTIVE"/>
            <User fullName="User2 masterjava01" email="user2m01@usermail.ru" city="mnsk" flag="DELETED"/>
        </Group>
        <Group name="masterjava02" type="CURRENT">
            <User fullName="Admin" email="admin@javaops.ru" city="spb" flag="SUPERUSER"/>
            <User fullName="User1 masterjava02" email="user1m02@usermail.ru" city="kiv" flag="ACTIVE"/>
            <User fullName="User2 masterjava02" email="user2m02@usermail.ru" city="mnsk" flag="DELETED"/>
        </Group>
        <Group name="masterjava03" type="REGISTERING">
            <User fullName="Admin" email="admin@javaops.ru" city="spb" flag="SUPERUSER"/>
            <User fullName="User1 masterjava03" email="user1m03@usermail.ru" city="kiv" flag="ACTIVE"/>
            <User fullName="User2 masterjava03" email="user2m03@usermail.ru" city="mnsk" flag="DELETED"/>
        </Group>
    </Project>
    <Cities>
        <City id="spb">Санкт-Петербург</City>
        <City id="kiv">Киев</City>
        <City id="mnsk">Минск</City>
    </Cities>
</Payload>